sys_title,sys_description,sys_content_plaintext,source,target
"use red hat software collections rhscl red hat developer toolset dts","access download red hat software collections rhscl red hat developer toolset dts access red hat software collections rhscl channel access rhscl rhel server rhscl channel rhel server rhscl rpms install packages latest versions included base channel apache httpd perl mysql mariadb ruby executive summary access red hat software collections rhscl red hat developer toolset dts included red hat enterprise linux rhel subscriptions getting packages rhscl dts requires enabling appropriate rhn channels rhn classic satellite yum repos rhsm rhn channel subscription manager repos commands instructions rhscl https access redhat com documentation red hat software collections html single release notes index html sect installation subscribe dts https access redhat com documentation red hat developer toolset html single user guide index html sect red hat developer toolset subscribe special request automated form click https www redhat com wapps try rhscl details necessary enable access appropriate channels repos additional entitlements need purchased product subscriptions entitlements rhscl available immediate use rhel rhel customers partners following rhel subscriptions red hat enterprise linux academic site subscription support levels red hat enterprise linux developer suite red hat enterprise linux developer support support levels red hat enterprise linux developer workstation support levels red hat enterprise linux resale nfr subscriptions qualifying partners red hat enterprise linux smart virtualization support levels red hat enterprise linux openstack platform support levels red hat cloud infrastructure support levels dts available immediate use rhel rhel customers partners following rhel subscriptions red hat enterprise linux academic site subscription support levels red hat enterprise linux developer suite red hat enterprise linux developer support support levels red hat enterprise linux developer workstation support levels red hat enterprise linux resale nfr subscriptions qualifying partners red hat enterprise linux smart virtualization support levels red hat enterprise linux openstack platform support levels red hat cloud infrastructure support levels customers following rhel subscriptions access rhscl dts free need initiate special request red hat enterprise linux server premium red hat enterprise linux server standard red hat enterprise linux workstation premium red hat enterprise linux workstation standard red hat enterprise linux academic server red hat enterprise linux academic workstation rhscl dts available use following rhel subscriptions red hat enterprise linux server self support red hat enterprise linux workstation self support enable rhscl dts repositories rhn classic rhsm rhscl refer installation chapter red hat software collections release notes https access redhat com documentation red hat software collections html single release notes index html sect installation subscribe dts refer getting access red hat developer toolset section red hat developer toolset user guide https access redhat com documentation red hat developer toolset html single user guide index html sect red hat developer toolset subscribe followed instructions enabling channels repos failed try requesting access channels following link www redhat com wapps try rhscl https www redhat com wapps try rhscl note access rhscl dts requested account organization administrator org admin includes initial customer portal user account users organization created role unsure org admin account open request red hat customer service https access redhat com support contact customerservice rhsm necessary attach add subscription called software collections developer toolset software collections developer toolset subscription added account reqesting access channels following link www redhat com wapps try rhscl https www redhat com wapps try rhscl attach remove subscriptions customer portal red hat subscription management https access redhat com solutions use subscription manager subscription manager gui commands note rhscl dts activated associated active entitlement entitlement expires renewed new request access need opened red hat software collections rhscl subscription removed expired https access redhat com site solutions learn additional details rhscl red hat enterprise linux developer program red hat software collections https access redhat com products red hat enterprise linux developer dev page red hat developer blog posts tagged software collections http developerblog redhat com tag software collections red hat software collections documentation https access redhat com site documentation red hat software collections extended update support eus red hat software collections rhscl included rhel https access redhat com solutions additional details dts red hat enterprise linux developer program developer toolset https developers redhat com products developertoolset overview red hat developer blog posts tagged developer toolset https developerblog redhat com tag developer toolset red hat developer toolset documentation https access redhat com site documentation red hat developer toolset use red hat software collections rhscl red hat developer toolset dts ","red hat software collections rhscl red hat enterprise linux rhel eus newer red hat software collections red hat software collections red hat developer toolset dts red hat enterprise linux rhel red hat developer toolset","api access redhat com:any","developertoolset"
"use containers dts tools cdk","interested knowing uses uses container images distributed dts releases cdk container development kit yes considering kind documentation tutorials useful getting started reference developer toolset user guide basic examples container usage container developm ","interested knowing uses uses container images distributed dts releases cdk container development kit yes considering kind documentation tutorials useful getting started reference developer toolset user guide basic examples container usage container development kit getting started guide basic examples docker openshift ","jbossorg_sbs_forum","developertoolset"
"cve cve affect red hat products","late research paper http www utexas edu shmat shmat ccs pdf published showing commonly libraries handled ssl connections failed verify server hostname matches domain subject subjectaltname field certificate apache httpclient libraries issue httpclient identified cve https access redhat com security cve cve main version streams httpclient currently use apache commons httpclient known apache jakarta commons httpclient apache httpcomponents httpclient reviewing patch november engineers red hat product security noticed fix cve https access redhat com security cve cve incomplete code added check server hostname matches domain subject field flawed exploited man middle mitm attack attacker spoof valid certificate specially crafted subject patch issue committed upstream http svn apache org viewvc view revision amp revision incorporated httpclient time unclear issue feasibly exploitable cve assigned apparent exploitable issue assigned cve https access redhat com security cve cve reported patch cve https access redhat com security cve cve incomplete man middle mitm attack attacker spoof valid certificate different specially crafted subject possible issue assigned cve https access redhat com security cve cve ","","rht_knowledgebase_solution","developertoolset"
"build custom rpm scl environment","building rpm uses devtoolset dts compilation recommended way write spec particular build section method build section build cat clean dts eof macro method build section build opt devtoolset enable configure parameters clean method official way scl enable annoying drawback starts second shell hitting ctrl build running effective kill rpmbuild method ctrl issue haven document approving methodology ","","rht_knowledgebase_solution","developertoolset"
"program linking libelf developer toolset fails","program linking libelf provided devtoolset elfutils libelf devel fails error gcc main main lcallelf lelf opt devtoolset root usr libexec gcc redhat linux main hidden symbol elf end opt devtoolset root usr lib gcc redhat linux lib libelf libelf elf end referenced dso opt devtoolset root usr libexec gcc redhat linux final link failed bad value collect error returned exit status","","rht_knowledgebase_solution","developertoolset"
"clarification mixing objects developer toolset dts","supported supported scenarios","","rht_knowledgebase_solution","developertoolset"
"red hat ship gcc","according gcc upstream https gcc gnu org gcc changes html quot gcc quot fully supported gcc gcc available rhel","","rht_knowledgebase_solution","developertoolset"
"compile code developer toolset execute different developer toolset installed","compile code compiler red hat developer toolset execute different red hat developer toolset installed","","rht_knowledgebase_solution","developertoolset"
"welcome developer toolset dts forum","hello welcome we re glad you re forum developers red hat developer toolset dts discuss topics installation getting started issues related developing dts encourage reach red hat developer community forum development questions generate discussions relevant ","hello welcome we re glad you re forum developers red hat developer toolset dts discuss topics installation getting started issues related developing dts encourage reach red hat developer community forum development questions generate discussions relevant topics don t afraid post forum participants peers likely appreciate discussions ways communicate red hat employee community include bugzilla red hat developer toolset https bugzilla redhat com enter bug cgi classification mailing list sclorg redhat com public scl upstream mailing list available body wants discuss topics related softwarecollections org project sign https www redhat com mailman listinfo sclorg red hat customer active subscription support log ticket https access redhat com support red hat meetups http www meetup com topics redhat fun remember stay topic it s good practice search previous posts related topic making new post red hat developer experience team ","jbossorg_sbs_forum","developertoolset"
"note red hat developer toolset moved stackoverflow","want best experience getting questions answered developer community believe stackoverflow format features moderation attracts broader community developers respond questions result forum read questions product red hat enterprise linux developer ","want best experience getting questions answered developer community believe stackoverflow format features moderation attracts broader community developers respond questions result forum read questions product red hat enterprise linux developer toolset rhel dts red hat developers stackoverflow page post questions stackoverflow redhat dts tag red hat continue monitor questions rhel dts stackoverflow stackoverflow heinz windzio product manager red hat developer program stack overflow red hat developers https developers redhat com articles post tag question stack overflow newest redhat dts questions stack overflow ","jbossorg_sbs_forum","developertoolset"
"devtoolset build newer library functions needing shared library client","missing correct libstdc shared library devtoolset","","rht_knowledgebase_solution","developertoolset"
"run commands software collections developer toolset","installing python software collection getting older version python rpm python python python python python version python compiler shows rhel compiler version having devtoolset gcc installed built specs collect gcc collect lto wrapper usr libexec gcc redhat linux lto wrapper target redhat linux configured configure prefix usr mandir usr share man infodir usr share info bugurl http bugzilla redhat com bugzilla enable bootstrap enable shared enable threads posix enable checking release zlib enable cxa atexit disable libunwind exceptions enable gnu unique object enable linker build linker hash style gnu enable languages objc obj java fortran ada lto enable plugin enable initfini array disable libgcj isl builddir build build gcc obj redhat linux isl install cloog builddir build build gcc obj redhat linux cloog install enable gnu indirect function tune generic arch build redhat linux thread model posix gcc version red hat gcc gcc installed developer toolset default compiler currently use absolute path opt devtoolset root usr bin gcc installing php module named apc php php pecl apc appear list php modules php grep apc ","","rht_knowledgebase_solution","developertoolset"
"devsuite installer work devsuite place","devsuite successfully configure container development environment devsuite installer prior artifacts removed","","rht_knowledgebase_solution","developertoolset"
"deploying multiple versions red hat developer toolset multiple rhel version","","deploy multiple versions red hat developer toolset multiple versions red hat enterprise linux","stackoverflow_question","developertoolset"
"deploying multiple versions red hat developer toolset multiple rhel version","","deploy multiple versions red hat developer toolset multiple versions red hat enterprise linux","stackoverflow_question","developertoolset"
