sys_title,sys_description,source,sys_content_plaintext,target
"jboss fuse jboss javax transact xaexcept transact xid.start thrown continu ari transact manag.","ari transact manag tri rollback transact connect restor threw follow except keep throw except indefinit.error input flight rollbacktask transact manag rollbacktask org apach ari transact manag redhat unexpect except commit org apach activemq jm pool genericresourcemanag connectionandwrappernamedxaresourc cddf continu commit rm javax transact xaexcept transact xid globalid cdffffffafeeeef branchid dffffffaeeef start.org apach activemq transactioncontext toxaexcept transactioncontext java org apach activemq activemq osgi redhat org apach activemq transactioncontext rollback transactioncontext java org apach activemq activemq osgi redhat org apach geronimo transact manag wrappernamedxaresourc rollback wrappernamedxaresourc java org apach ari transact manag redhat org apach geronimo transact manag rollbacktask run rollbacktask java org apach ari transact manag redhat org apach geronimo transact manag transactionimpl rollbackresourc transactionimpl java org apach ari transact manag redhat org apach geronimo transact manag transactionimpl commit transactionimpl java org apach ari transact manag redhat org apach geronimo transact manag transactionmanagerimpl commit transactionmanagerimpl java org apach ari transact manag redhat org springframework transact jta jtatransactionmanag docommit jtatransactionmanag java org springframework transact support abstractplatformtransactionmanag processcommit abstractplatformtransactionmanag java org springframework transact support abstractplatformtransactionmanag commit abstractplatformtransactionmanag java org apach ari transact intern ariesplatformtransactionmanag commit ariesplatformtransactionmanag java sun reflect generatedmethodaccessor invok unknown sourc sun reflect delegatingmethodaccessorimpl invok delegatingmethodaccessorimpl java java lang reflect method invok method java org springframework aop support aoputil invokejoinpointusingreflect aoputil java org apach servicemix bundl spring aop releas org springframework osgi servic import support intern aop serviceinvok doinvok serviceinvok java org springframework osgi core org springframework osgi servic import support intern aop serviceinvok invok serviceinvok java org springframework osgi core org springframework aop framework reflectivemethodinvoc proce reflectivemethodinvoc java org apach servicemix bundl spring aop releas org springframework aop support delegatingintroductioninterceptor doproce delegatingintroductioninterceptor java org apach servicemix bundl spring aop releas org springframework aop support delegatingintroductioninterceptor invok delegatingintroductioninterceptor java org apach servicemix bundl spring aop releas org springframework aop framework reflectivemethodinvoc proce reflectivemethodinvoc java org apach servicemix bundl spring aop releas org springframework osgi servic util intern aop servicetcclinterceptor invokeunprivileg servicetcclinterceptor java org springframework osgi core org springframework osgi servic util intern aop servicetcclinterceptor invok servicetcclinterceptor java org springframework osgi core org springframework aop framework reflectivemethodinvoc proce reflectivemethodinvoc java org apach servicemix bundl spring aop releas org springframework osgi servic import support localbundlecontextadvic invok localbundlecontextadvic java org springframework osgi core org springframework aop framework reflectivemethodinvoc proce reflectivemethodinvoc java org apach servicemix bundl spring aop releas org springframework aop support delegatingintroductioninterceptor doproce delegatingintroductioninterceptor java org apach servicemix bundl spring aop releas org springframework aop support delegatingintroductioninterceptor invok delegatingintroductioninterceptor java org apach servicemix bundl spring aop releas org springframework aop framework reflectivemethodinvoc proce reflectivemethodinvoc java org apach servicemix bundl spring aop releas org springframework aop framework jdkdynamicaopproxi invok jdkdynamicaopproxi java org apach servicemix bundl spring aop releas com sun proxi proxi commit unknown sourc org springframework jm listen abstractpollingmessagelistenercontain receiveandexecut abstractpollingmessagelistenercontain java org apach servicemix bundl spring jm releas org springframework jm listen defaultmessagelistenercontain asyncmessagelistenerinvok invokelisten defaultmessagelistenercontain java org apach servicemix bundl spring jm releas org springframework jm listen defaultmessagelistenercontain asyncmessagelistenerinvok executeongoingloop defaultmessagelistenercontain java org apach servicemix bundl spring jm releas org springframework jm listen defaultmessagelistenercontain asyncmessagelistenerinvok run defaultmessagelistenercontain java org apach servicemix bundl spring jm releas java util concurr threadpoolexecutor runwork threadpoolexecutor java java util concurr threadpoolexecutor worker run threadpoolexecutor java java lang thread run thread java caus javax transact xaexcept transact xid globalid cdffffffafeeeef branchid dffffffaeeef start.org apach activemq broker transactionbrok gettransact transactionbrok java org apach activemq broker transactionbrok rollbacktransact transactionbrok java org apach activemq broker brokerfilt rollbacktransact brokerfilt java org apach activemq broker mutablebrokerfilt rollbacktransact mutablebrokerfilt java org apach activemq broker transportconnect processrollbacktransact transportconnect java org apach activemq command transactioninfo visit transactioninfo java org apach activemq broker transportconnect servic transportconnect java org apach activemq broker transportconnect oncommand transportconnect java org apach activemq transport mutextransport oncommand mutextransport java org apach activemq transport wireformatnegoti oncommand wireformatnegoti java org apach activemq transport abstractinactivitymonitor oncommand abstractinactivitymonitor java org apach activemq transport transportsupport doconsum transportsupport java org apach activemq transport tcp tcptransport dorun tcptransport java org apach activemq activemq osgi redhat org apach activemq transport tcp tcptransport run tcptransport java org apach activemq activemq osgi redhat.","rht_knowledgebase_solution","","amq"
"get java lang unsupportedoperationexcept possibl csrf attack hit delet purg go queue page button web consol","hit quot delet quot quot purg quot destin page quot queue quot quot topic quot go page hit web browser quot quot button got quot http error intern server error server except occur process request check log inform quot follow warn messag amq log warn qtp servlethandl lips jetti util log javautillog org eclips jetti util activemqweb deletedestin action java lang unsupportedoperationexcept possibl csrf attack org apach activemq web handler bindingbeannameurlhandlermap gethandlerintern bindingbeannameurlhandlermap java org jboss amq web consol redhat org springframework web servlet handler abstracthandlermap gethandl abstracthandlermap java org jboss amq web consol redhat org springframework web servlet dispatcherservlet gethandl dispatcherservlet java org jboss amq web consol redhat org springframework web servlet dispatcherservlet gethandl dispatcherservlet java org jboss amq web consol redhat org springframework web servlet dispatcherservlet dodispatch dispatcherservlet java org jboss amq web consol redhat org springframework web servlet dispatcherservlet doservic dispatcherservlet java org jboss amq web consol redhat org springframework web servlet frameworkservlet processrequest frameworkservlet java org jboss amq web consol redhat org springframework web servlet frameworkservlet doget frameworkservlet java org jboss amq web consol redhat javax servlet http httpservlet servic httpservlet java org apach geronimo spec geronimo servlet spec javax servlet http httpservlet servic httpservlet java org apach geronimo spec geronimo servlet spec org eclips jetti servlet servlethold handl servlethold java org eclips jetti servlet org eclips jetti servlet servlethandl cachedchain dofilt servlethandl java org eclips jetti servlet org apach activemq web auditfilt dofilt auditfilt java org jboss amq web consol redhat org eclips jetti servlet servlethandl cachedchain dofilt servlethandl java org eclips jetti servlet org springframework web filter requestcontextfilt dofilterintern requestcontextfilt java org jboss amq web consol redhat org springframework web filter onceperrequestfilt dofilt onceperrequestfilt java org jboss amq web consol redhat org eclips jetti servlet servlethandl cachedchain dofilt servlethandl java org eclips jetti servlet org apach activemq web filter applicationcontextfilt dofilt applicationcontextfilt java org jboss amq web consol redhat org eclips jetti servlet servlethandl cachedchain dofilt servlethandl java org eclips jetti servlet com opensymphoni sitemesh webapp sitemeshfilt obtaincont sitemeshfilt java org jboss amq web consol redhat com opensymphoni sitemesh webapp sitemeshfilt dofilt sitemeshfilt java org jboss amq web consol redhat org eclips jetti servlet servlethandl cachedchain dofilt servlethandl java org eclips jetti servlet org opsj pax web servic intern welcomefilesfilt dofilt welcomefilesfilt java org opsj pax web pax web runtim org eclips jetti servlet servlethandl cachedchain dofilt servlethandl java org eclips jetti servlet org eclips jetti servlet servlethandl dohandl servlethandl java org eclips jetti servlet org opsj pax web servic jetti intern httpserviceservlethandl dohandl httpserviceservlethandl java org opsj pax web pax web jetti org eclips jetti server handler scopedhandl handl scopedhandl java org eclips jetti server org eclips jetti secur securityhandl handl securityhandl java org eclips jetti secur org eclips jetti server session sessionhandl dohandl sessionhandl java org eclips jetti server org eclips jetti server handler contexthandl dohandl contexthandl java org eclips jetti server org opsj pax web servic jetti intern httpservicecontext dohandl httpservicecontext java org opsj pax web pax web jetti org eclips jetti servlet servlethandl doscop servlethandl java org eclips jetti servlet org eclips jetti server session sessionhandl doscop sessionhandl java org eclips jetti server org eclips jetti server handler contexthandl doscop contexthandl java org eclips jetti server org eclips jetti server handler scopedhandl handl scopedhandl java org eclips jetti server org opsj pax web servic jetti intern jettyserverhandlercollect handl jettyserverhandlercollect java org opsj pax web pax web jetti org eclips jetti server handler handlerwrapp handl handlerwrapp java org eclips jetti server org eclips jetti server server handl server java org eclips jetti server org eclips jetti server abstracthttpconnect handlerequest abstracthttpconnect java org eclips jetti server org eclips jetti server abstracthttpconnect headercomplet abstracthttpconnect java org eclips jetti server org eclips jetti server abstracthttpconnect requesthandl headercomplet abstracthttpconnect java org eclips jetti server org eclips jetti http httpparser parsenext httpparser java org eclips jetti http org eclips jetti http httpparser parseavail httpparser java org eclips jetti http org eclips jetti server asynchttpconnect handl asynchttpconnect java org eclips jetti server org eclips jetti nio selectchannelendpoint handl selectchannelendpoint java org eclips jetti org eclips jetti nio selectchannelendpoint run selectchannelendpoint java org eclips jetti org eclips jetti util thread queuedthreadpool runjob queuedthreadpool java org eclips jetti util org eclips jetti util thread queuedthreadpool run queuedthreadpool java org eclips jetti util java lang thread run thread java warn qtp servlethandl lips jetti util log javautillog org eclips jetti util activemqweb purgedestin action java lang unsupportedoperationexcept possibl csrf attack org apach activemq web handler bindingbeannameurlhandlermap gethandlerintern bindingbeannameurlhandlermap java org jboss amq web consol redhat org springframework web servlet handler abstracthandlermap gethandl abstracthandlermap java org jboss amq web consol redhat org springframework web servlet dispatcherservlet gethandl dispatcherservlet java org jboss amq web consol redhat org springframework web servlet dispatcherservlet gethandl dispatcherservlet java org jboss amq web consol redhat org springframework web servlet dispatcherservlet dodispatch dispatcherservlet java org jboss amq web consol redhat org springframework web servlet dispatcherservlet doservic dispatcherservlet java org jboss amq web consol redhat org springframework web servlet frameworkservlet processrequest frameworkservlet java org jboss amq web consol redhat org springframework web servlet frameworkservlet doget frameworkservlet java org jboss amq web consol redhat javax servlet http httpservlet servic httpservlet java org apach geronimo spec geronimo servlet spec javax servlet http httpservlet servic httpservlet java org apach geronimo spec geronimo servlet spec org eclips jetti servlet servlethold handl servlethold java org eclips jetti servlet org eclips jetti servlet servlethandl cachedchain dofilt servlethandl java org eclips jetti servlet org apach activemq web auditfilt dofilt auditfilt java org jboss amq web consol redhat org eclips jetti servlet servlethandl cachedchain dofilt servlethandl java org eclips jetti servlet org springframework web filter requestcontextfilt dofilterintern requestcontextfilt java org jboss amq web consol redhat org springframework web filter onceperrequestfilt dofilt onceperrequestfilt java org jboss amq web consol redhat org eclips jetti servlet servlethandl cachedchain dofilt servlethandl java org eclips jetti servlet org apach activemq web filter applicationcontextfilt dofilt applicationcontextfilt java org jboss amq web consol redhat org eclips jetti servlet servlethandl cachedchain dofilt servlethandl java org eclips jetti servlet com opensymphoni sitemesh webapp sitemeshfilt obtaincont sitemeshfilt java org jboss amq web consol redhat com opensymphoni sitemesh webapp sitemeshfilt dofilt sitemeshfilt java org jboss amq web consol redhat org eclips jetti servlet servlethandl cachedchain dofilt servlethandl java org eclips jetti servlet org opsj pax web servic intern welcomefilesfilt dofilt welcomefilesfilt java org opsj pax web pax web runtim org eclips jetti servlet servlethandl cachedchain dofilt servlethandl java org eclips jetti servlet org eclips jetti servlet servlethandl dohandl servlethandl java org eclips jetti servlet org opsj pax web servic jetti intern httpserviceservlethandl dohandl httpserviceservlethandl java org opsj pax web pax web jetti org eclips jetti server handler scopedhandl handl scopedhandl java org eclips jetti server org eclips jetti secur securityhandl handl securityhandl java org eclips jetti secur org eclips jetti server session sessionhandl dohandl sessionhandl java org eclips jetti server org eclips jetti server handler contexthandl dohandl contexthandl java org eclips jetti server org opsj pax web servic jetti intern httpservicecontext dohandl httpservicecontext java org opsj pax web pax web jetti org eclips jetti servlet servlethandl doscop servlethandl java org eclips jetti servlet org eclips jetti server session sessionhandl doscop sessionhandl java org eclips jetti server org eclips jetti server handler contexthandl doscop contexthandl java org eclips jetti server org eclips jetti server handler scopedhandl handl scopedhandl java org eclips jetti server org opsj pax web servic jetti intern jettyserverhandlercollect handl jettyserverhandlercollect java org opsj pax web pax web jetti org eclips jetti server handler handlerwrapp handl handlerwrapp java org eclips jetti server org eclips jetti server server handl server java org eclips jetti server org eclips jetti server abstracthttpconnect handlerequest abstracthttpconnect java org eclips jetti server org eclips jetti server abstracthttpconnect headercomplet abstracthttpconnect java org eclips jetti server org eclips jetti server abstracthttpconnect requesthandl headercomplet abstracthttpconnect java org eclips jetti server org eclips jetti http httpparser parsenext httpparser java org eclips jetti http org eclips jetti http httpparser parseavail httpparser java org eclips jetti http org eclips jetti server asynchttpconnect handl asynchttpconnect java org eclips jetti server org eclips jetti nio selectchannelendpoint handl selectchannelendpoint java org eclips jetti org eclips jetti nio selectchannelendpoint run selectchannelendpoint java org eclips jetti org eclips jetti util thread queuedthreadpool runjob queuedthreadpool java org eclips jetti util org eclips jetti util thread queuedthreadpool run queuedthreadpool java org eclips jetti util java lang thread run thread java","rht_knowledgebase_solution","","amq"
"ssl configur web consol port cipher usag variabl jboss fuse","result secur check need restrict cipher list document link http access redhat com site document red hat jboss html secur guid file webconsol html cover issu.addition link http wiki eclips org jetti howto configur ssl default connector type org eclips jetti server nio selectchannelconnector jetti xml wonder work provid ssl implicitli us properti org opsj pax web cfg.like keystor password restrict cipher chang connector type org eclips jetti server ssl sslsocketconnector configur sslcontextfactori includ cipher list explicitli valu keystor password.us variabl defin org opsj pax web cfg us addition like know port set.jetti port come.port org opsj pax web cfg deactiv default port enabl parallel.org opsj pax web cfg org osgi servic http enabl fals org osgi servic http secur enabl true org osgi servic http port org osgi servic http port secur org opsj pax web ssl keystor keystor org opsj pax web ssl password keystorepassword org opsj pax web ssl keypassword keystorepassword org opsj pax web ssl clientauthw fals org opsj pax web ssl clientauthneed fals org opsj pax web config file base jetti xml.","rht_knowledgebase_solution","","amq"
"messag bodi appear write jboss","got amq broker jdbc persist coupl camel rout similar.rout redirect jm messag base condit usual check certain jm properti jm header.send messag foo hawtio work fine.messag deliv bar expect.apach cxf base test achiev webservic send jm messag configur slightli differ.guess actual send messag extraordinari wai amq receiv jm messag deliv messag expect target queue throw except messag bodi write wai amq camel log jm messag object.like look messag rout successfulli abl compar problemat on.","rht_knowledgebase_solution","","amq"
"jdbc configur ibm fuse","unabl sampl configur ibm like oracl setup link http access redhat com site document red hat jboss html configur broker persist file fusembpersistjdbcbas html http access redhat com site document red hat jboss html configur broker persist file fusembpersistjdbcbas html let know configur jdbc configur ibm driver","rht_knowledgebase_solution","","amq"
"configur timetol paramet secur cxf","configur timetol paramet secur timestamp timetol secur timestamp futuretimetol default valu secur timestamp timetol secur timestamp futuretimetol exampl spring bean xml","rht_knowledgebase_solution","","amq"
"camel activemq connect creat lot null transact commit","notic environ lot debug level messag like.debug camel process thread jmsconsum queue testqueu activemqsess org apach activemq activemq core fuse transact commit null debug camel process thread jmsconsum queue testqueu activemqsess org apach activemq activemq core fuse transact commit null debug camel process thread jmsconsum queue testqueu activemqsess org apach activemq activemq core fuse transact rollback txid null work correctli believ transact spring activemq camel incorrectli caus null transact creat commit continu spring creat activemq bean camel.correct best.activemqserv activemqserverusernam activemqserverpassword.","rht_knowledgebase_solution","","amq"
"pre patch distribut fuse avail","patch current awkward fabric manual fmc have pre patch distribut us pre patch version jboss fuse avail need instal patch everytim test pre patch instal binairi.pre patch instal avail.","rht_knowledgebase_solution","","amq"
"random port jboss fuse jboss","netstat command look like us random port number purpos port specifi port number port","rht_knowledgebase_solution","","amq"
"jboss set deletemessagesonstartup throw java sql sqlexcept commit auto commit set","oracl driver get follow except deletemessagesonstartup true caus java sql sqlexcept commit auto commit set oracl jdbc driver physicalconnect commit physicalconnect java oracl jdbc driver physicalconnect commit physicalconnect java org apach common dbcp delegatingconnect commit delegatingconnect java org apach common dbcp delegatingconnect commit delegatingconnect java org apach common dbcp poolingdatasourc poolguardconnectionwrapp commit poolingdatasourc java org apach activemq store jdbc adapt defaultjdbcadapt dodropt defaultjdbcadapt java org apach activemq store jdbc jdbcpersistenceadapt deleteallmessag jdbcpersistenceadapt java","rht_knowledgebase_solution","","amq"
"regist custom bean jmx mbean fuse","possibl regist bean jmx mbean insid fuse esb contain.prefer wai check jconsol appear bean regist.step exampl demonstr blueprint.wai us blueprint configur.","rht_knowledgebase_solution","","amq"
"chang user oracl databas jdbc persist","configur jboss appropri prefix tabl name own schema jboss connect databas user activemqus","rht_knowledgebase_solution","","amq"
"prohibit user creat publish consum queue topic","prohibit user creat publish consum queue topic.disabl auto destin creation.possibl prevent creat queue pre defin queue.","rht_knowledgebase_solution","","amq"
"limit number messag queue","want know limit messag size queue limit disk usag queue.know limit queue queue consum slow disk size messag destin.purpos let destin global impact.want limit queue messag size.queue messag size achiev limit client send messag queue.","rht_knowledgebase_solution","","amq"
"produc flow control async send work","produc flow control block async produc","rht_knowledgebase_solution","","amq"
"possibl separ user process executor","requir instal differ linux user execut differ user.linux user execut jvm process quot execut quot user differ user own binari file librari quot instal quot user write access file.prefer origin product left untouch unzip quot instal quot user quot execut quot user modifi file deploi log separ directori structur support wai meet requir separ user directori.","rht_knowledgebase_solution","","amq"
"multipl activemq consum read queue work concurr","compet consum pattern work fuse multipl activemq consum read queue quot session auto acknowledg quot mode process messag concurr","rht_knowledgebase_solution","","amq"
"java support red hat jboss","plan support java.red hat support java recent came know public updat oracl jdk end april.check support run oracl jdk.","rht_knowledgebase_solution","","amq"
"role base access control rbac","support rbac","rht_knowledgebase_solution","","amq"
"javax jm jmsexcept unmatch acknowledg messageack mqtt client","run mqtt client regularli follow except warn nio worker servic ivemq broker transportconnect org apach activemq activemq osgi redhat async error occur javax jm jmsexcept unmatch acknowledg messageack commandid responserequir fals acktyp consumerid firstmessageid null lastmessageid destin topic test transactionid null messagecount poisoncaus null expect messag count differ count dispatch list caus behavior","rht_knowledgebase_solution","","amq"
"jboss support symantec cf","symantec cf support red hat jboss","rht_knowledgebase_solution","","amq"
"understand jboss fuse jboss patch","differ kind patch jboss fuse jboss patch denot patch denot differ differ regular patch rollup patch order patch instal","rht_knowledgebase_solution","","amq"
"us camel connect activemq amqp","try creat blueprint camel rout camel amqp compon connect activemq broker amqp.work.","rht_knowledgebase_solution","","amq"
"recommend wai instal rollup patch have prerequisit patch","environ current rollup rollup patch instal.wonder rollup patch patch list recommend wai instal rollup patch have prerequisit patch instal read prerequisit patch requir instal rollup patch.","rht_knowledgebase_solution","","amq"
"red hat support glusterf share storag activemq","wonder red hat support glusterf jboss.look possibl replac current solut nf kahadb store glusterf solut.","rht_knowledgebase_solution","","amq"
