sys_title,sys_description,source,sys_content_plaintext,target
"jboss overview","rob davi provid overview jboss","","","amq"
"get start","introduct setup start quickli possibl jboss video tour product","","","amq"
"jboss commun","involv commun jboss","jbossdeveloper_website","red hat jboss technolog product jboss menu overview start resourc develop materi commun download jboss commun jboss great wai build real world enterpris applic base latest technolog.need fix new featur suggest.get involv jboss commun feedback improv doc review code discuss propos new featur they r need.answer user question take develop discuss great wai build reput collabor expertis field.matter skill level contribut jboss reward great learn experi.you ll meet lot smart passion develop driven creat best middlewar possibl open sourc.don t expert involv doesn t lot time.learn contribut forum provid support user great wai collabor commun.lot question ask answer dai forum.you r jboss want futur develop talk product team forum voic heard.visit jboss forum project standard includ jboss jboss develop download support solut contact sale consult solut support train red hat jboss train cours develop red hat jboss train cours administr report problem secur vulner.report.","amq"
"jboss start","learn instal start jboss","jbossdeveloper_website","red hat jboss technolog product jboss menu overview start resourc develop materi commun download jboss thank download jboss.problem download.us direct link.checksum download sha.download avail jboss develop program join.view term condit.subscript jboss develop program end.start instruct instal osx window linux download jboss zip instal.download.sure jdk choic instal.recommend openjdk oracl jdk.window mac extract content zip archiv doubl click zip file.linux open termin window target machin navig zip file download.extract zip file execut follow command unzip jboss amq zip option instal integr stack jboss develop studio.provid id support develop jboss applic.detail instal instruct.detail view product document.configur apache  maven locat maven instal directori oper.usual instal user home.linux mac window document set user user user exist set xml file renam restor later.linux mac set xml set backup xml window ren document set user set xml set backup xml ren user user set xml set backup xml exist repositori directori renam restor later.exampl linux mac repositori repositori backup window ren document set user repositori repositori backup ren user user repositori repositori backup copi set xml file root quickstart directori maven instal directori.linux mac quickstart home set xml set xml window copi quickstart home set xml document set user set xml copi quickstart home set xml user user set xml build applic help build messag solut.fuse start page.jboss develop download support solut contact sale consult solut support train red hat jboss train cours develop red hat jboss train cours administr report problem secur vulner.report.","amq"
"sensortag lightblu bean intel edison mqtt","apach activemq jboss fuse mqtt capabl read temperatur sensortag analyz temp apach camel","","","amq"
"setup storag support fail","dear artemi document recommend us san instead nf mount drive.build new infrastructur window base test effici persist fail mode.connect san lun directli virtual server.right wai configur san fail.risk corrupt file configur.","jbossorg_sbs_forum","dear artemi document recommend us san instead nf mount drive.build new infrastructur window base test effici persist fail mode.connect san lun directli virtual server.right wai configur san fail.risk corrupt file configur server write file.doc subject.thank help.r my.","amq"
"licens","need red hat subscript inord us jboss product.us product pai fee.ye product product licens.","jbossorg_sbs_forum","need red hat subscript inord us jboss product.us product pai fee.ye product product licens.","amq"
"jboss jasypt password encrypt servic","instal configur jasypt servic jboss.configur org apach karaf jaa cfg boolean enabl disabl encrypt password encrypt enabl true encrypt servic default basic power name jasypt avail instal encrypt featur encrypt jasypt encrypt.","jbossorg_sbs_forum","instal configur jasypt servic jboss.configur org apach karaf jaa cfg boolean enabl disabl encrypt password encrypt enabl true encrypt servic default basic power name jasypt avail instal encrypt featur encrypt jasypt encrypt prefix encrypt prefix crypt encrypt suffix encrypt suffix crypt set encrypt algorithm us karaf jaa login modul support encrypt algorithm follow sha sha sha sha encrypt algorithm encod encrypt password.hexadecim base encrypt encod base configur activemq xml file user karaf base user properti error log org springframework bean factori beandefinitionstoreexcept unrecogn xbean namespac map http karaf apach org xmln jaa let know correct namespac url jass config tag activemq xml.let know step miss setup jasypt.","amq"
"web consol share jaa secur context contain amq","follow question post fuse enterpris thread answer give try follow question possibl share secur context amq amq contain embed extern web consol fuse enterpris jboss fuse jboss.main goal.","jbossorg_sbs_forum","follow question post fuse enterpris thread answer give try follow question possibl share secur context amq amq contain embed extern web consol fuse enterpris jboss fuse jboss.main goal allow user connect amq web consol jaa authent base apach exampl forget default file amq.authent given user access destin access assign contain.provid tutori exampl cover exclusev contain secur standalon amq fuse combin share author contain webconsol.possibl current version amq.ye provid step step configur approach.regard.","amq"
"jboss hornet fip compliant","current explor jm suitabl product work.basic requir jm fip compliant.jboss hornet fip compliant.couldn specif document.answer help.thank advanc.","jbossorg_sbs_forum","current explor jm suitabl product work.basic requir jm fip compliant.jboss hornet fip compliant.couldn specif document.answer help.thank advanc.","amq"
"jboss alpha git problem caus fuse mgt consol error","new fuse fabric instal new alpha version client need replic leveldb.manag consol creat fabric result configur tab error profil list typeerror method exist null gitwikirepositori exist http devapp marlo com hawtio app app checkfil.","jbossorg_sbs_forum","new fuse fabric instal new alpha version client need replic leveldb.manag consol creat fabric result configur tab error profil list typeerror method exist null gitwikirepositori exist http devapp marlo com hawtio app app checkfileexist http devapp marlo com hawtio app app object http devapp marlo com hawtio app app object scope digest http devapp marlo com hawtio lib angular object scope appli http devapp marlo com hawtio lib angular htmldocument.http devapp marlo com hawtio lib angular htmldocument event disp atch http devapp marlo com hawtio lib jqueri min htmldocument handl http devapp marlo com hawtio lib jqueri min click creat creat test profil save error occur displai configur tab notic fabric runtim tab manag select root url tab git jolokia url blank.thought.document mention git think new draft doco alpha.","amq"
"jboss rest api","equival page follow jboss.http activemq apach org rest html help start appreci.page http access redhat com site document jboss html client connect guid file amqconnectrestmessag html best place start know creat obtain webcontext.","jbossorg_sbs_forum","equival page follow jboss.http activemq apach org rest html help start appreci.page http access redhat com site document jboss html client connect guid file amqconnectrestmessag html best place start know creat obtain webcontext initi demo.point step step page similar activemq link.thank.","amq"
"issu shut broker","experienc issu stop broker servic caus try stop servic activemqconnect new check ad broker state stop throw brokerstoppedexcept.check ad new version jboss amq transportconnect class.stop transport connector.","jbossorg_sbs_forum","experienc issu stop broker servic caus try stop servic activemqconnect new check ad broker state stop throw brokerstoppedexcept.check ad new version jboss amq transportconnect class.stop transport connector stop broker servic work fine.sure bug featur requir chang implement applic.","amq"
"limit number mdb activemq","problem test jboss wildfli.applic connect activemq work good number mdb limit session particular queue.check configur try luck far.rar file resourc adapt modifi.standalon xml requir activemq configur subsystem xmln urn.","jbossorg_sbs_forum","problem test jboss wildfli.applic connect activemq work good number mdb limit session particular queue.check configur try luck far.rar file resourc adapt modifi.standalon xml requir activemq configur activemq rar notransact tcp queue queue queue queue exampl mdb messagedriven activationconfig activationconfigproperti propertynam acknowledgemod propertyvalu auto acknowledg activationconfigproperti propertynam destinationtyp propertyvalu javax jm queue activationconfigproperti propertynam destin propertyvalu queue queue note physic queue resourceadapt activemq rar transactionmanag valu transactionmanagementtyp contain public class consum implement messagelisten public consum overrid public void onmessag messag messag try messag instanceof textmessag println got messag textmessag messag gettext long threadid thread currentthread getid println threadid try thread sleep sleep provid max number mdb.catch interruptedexcept todo auto gener catch block printstacktrac catch jmsexcept printstacktrac wilfli manag model view deploy test ejb jm jar subsystem ejb messag driven bean consum compon class consum declar role deliveri activ true execut time invoc method peak concurr invoc pool avail count pool creat count pool current size pool max size pool mdb strict max pool pool remov count run role undefin secur domain timer wait time servic undefin suggest number mdb limit.","amq"
"issu relat webspher osgi jndi featur conflict","step reproduc connect webspher ldap jndi deploi osgi osgi instal put provid osgi bundl deploi folder deploi code connect webspher ldap jndi fuse work fine instal featur featur instal jndi deploi code error javax name refer cast javax jm","jbossorg_sbs_forum","step reproduc connect webspher ldap jndi deploi osgi osgi instal put provid osgi bundl deploi folder deploi code connect webspher ldap jndi fuse work fine instal featur featur instal jndi deploi code error javax name refer cast javax jm queueconnectionfactori detail fuse esb fuse bundl com ibm msg client osgi jm prereq jar com ibm msg client osgi jm jar com ibm msg client osgi wmq prereq jar com ibm msg client osgi wmq jar com ibm msg client osgi nl jar com ibm msg client osgi commonservic jse jar com ibm osgi directip jar com ibm msg client osgi wmq nl jar com ibm osgi java jar","amq"
"load balanc activemq","explain setup load balanc amq cluster master slave.master slave pair.instanc link like node node node node node node node node.master master slave slave postgr databas postgr databas scheme http temporari file radik.","jbossorg_sbs_forum","explain setup load balanc amq cluster master slave.master slave pair.instanc link like node node node node node node node node.master master slave slave postgr databas postgr databas scheme http temporari file radik dcdcdabefb jpg question.master lock slave wait master failur.webconsol master node.messag master forward master load balanc.set master transportconnector openwir slave transportconnector openwir master transportconnector openwir slave transportconnector openwir connect consum failov tcp tcp tcp tcp random fals produc connect failov like consum.webconsol.number consum master node.messag goe master node.set node conduitsubscript fals node number consum messag forward node.wrong.","amq"
"jboss start","jboss instal red hat.unabl start admin consol.execut amq script insid bin folder follow wait jboss initi.happen.tri increas log properti file output displai.know troubleshoot.","jbossorg_sbs_forum","jboss instal red hat.unabl start admin consol.execut amq script insid bin folder follow wait jboss initi.happen.tri increas log properti file output displai.know troubleshoot log output.","amq"
"activemqweb consol stylesheet improv","view messag us part font color background mark page mous","jbossorg_sbs_forum","view messag us part font color background mark page mous","amq"
"dlq flood strategi","look inform common strategi handl situat dlq get flood slow rest throughput.hear previou version amq problem consum memori messag dlq.insight help.","jbossorg_sbs_forum","look inform common strategi handl situat dlq get flood slow rest throughput.hear previou version amq problem consum memori messag dlq.insight help.","amq"
"oracl databas persist","like us oracl databas persist layer.review document http access redhat com document red hat jboss html configur broker persist file fusembpersistjdbcstor html.requir creat schema oracl databas permiss need schema.","jbossorg_sbs_forum","like us oracl databas persist layer.review document http access redhat com document red hat jboss html configur broker persist file fusembpersistjdbcstor html.requir creat schema oracl databas permiss need schema.list requir permiss refer.thank.","amq"
"fabric manag server bound port","current setup fabric server run root contain separ ssh manag contain name contain differ.deploi amq profil contain run hawtio consol contain creat queue topic hawtio web consol.activemq tab hawtio web.","jbossorg_sbs_forum","current setup fabric server run root contain separ ssh manag contain name contain differ.deploi amq profil contain run hawtio consol contain creat queue topic hawtio web consol.activemq tab hawtio web consol show transport connector properti tcp.ssh contain netstat dont program bound port listen connect.question listen port manag fabric wai commun broker fabric commun zookeep url.thank.","amq"
"jboss rest support","doc rest protocol support look best mention support http protocol.rest gone miss.http protocol.","jbossorg_sbs_forum","doc rest protocol support look best mention support http protocol.rest gone miss.http protocol.","amq"
"activemq queue","time jm hornetq work fine.try activemq work configur queue wildfli manag interfac start standalon xml affiliatewindowqueu jndi name java jm queue affiliatewindowqueu try lookup queue public final static string jm queue jndi jm queue affili.","jbossorg_sbs_forum","time jm hornetq work fine.try activemq work configur queue wildfli manag interfac start standalon xml affiliatewindowqueu jndi name java jm queue affiliatewindowqueu try lookup queue public final static string jm queue jndi jm queue affiliatewindowqueu try queue queue ctx lookup jm queue jndi catch namingexcept println namingexcept javax name namenotfoundexcept jm queue affiliatewindowqueu servic jboss name context java jboss export jm queue affiliatewindowqueu except thread main java lang unsupportedoperationexcept specifi destin produc default destin org apach activemq artemi jm client activemqmessageproduc checkdefaultdestin activemqmessageproduc java org apach activemq artemi jm client activemqmessageproduc send activemqmessageproduc java com nohagl jm createaffiliatewindowdatabas send createaffiliatewindowdatabas java com nohagl jm createaffiliatewindowdatabas readandsend createaffiliatewindowdatabas java com nohagl jm createaffiliatewindowdatabas main createaffiliatewindowdatabas java sun reflect nativemethodaccessorimpl invok nativ method sun reflect nativemethodaccessorimpl invok nativemethodaccessorimpl java sun reflect delegatingmethodaccessorimpl invok delegatingmethodaccessorimpl java java lang reflect method invok method java com intellij execut applic appmain main appmain java pointer.","amq"
"abl setup persist","get follow error try configur oracl warn org apach activemq artemi core server amq critic error shut server.file null messag ora invalid datatyp java sql sqlsyntaxerrorexcept ora invalid datatyp oracl jdbc driver tcttioer processerror tcttioer java ojdbc jar.","jbossorg_sbs_forum","get follow error try configur oracl warn org apach activemq artemi core server amq critic error shut server.file null messag ora invalid datatyp java sql sqlsyntaxerrorexcept ora invalid datatyp oracl jdbc driver tcttioer processerror tcttioer java ojdbc jar oracl jdbc driver tcttioer processerror tcttioer java ojdbc jar oracl jdbc driver tcoall processerror tcoall java ojdbc jar oracl jdbc driver tcttifun receiv tcttifun java ojdbc jar oracl jdbc driver tcttifun dorpc tcttifun java ojdbc jar oracl jdbc driver tcoall dooall tcoall java ojdbc jar oracl jdbc driver tcstatement dooall tcstatement java ojdbc jar oracl jdbc driver tcstatement dooall tcstatement java ojdbc jar oracl jdbc driver tcstatement executeforrow tcstatement java ojdbc jar oracl jdbc driver oraclestat doexecutewithtimeout oraclestat java ojdbc jar oracl jdbc driver oraclestat executeupdateintern oraclestat java ojdbc jar oracl jdbc driver oraclestat executeupd oraclestat java ojdbc jar oracl jdbc driver oraclestatementwrapp executeupd oraclestatementwrapp java ojdbc jar org apach activemq artemi jdbc store jdbcutil createtableifnotexist jdbcutil java artemi jdbc store amq redhat jar amq redhat org apach activemq artemi jdbc store journal jdbcjournalimpl start jdbcjournalimpl java artemi jdbc store amq redhat jar amq redhat org apach activemq artemi core persist impl journal jdbcjournalstoragemanag init jdbcjournalstoragemanag java artemi server amq redhat jar amq redhat org apach activemq artemi core persist impl journal abstractjournalstoragemanag abstractjournalstoragemanag java artemi server amq redhat jar amq redhat org apach activemq artemi core persist impl journal journalstoragemanag journalstoragemanag java artemi server amq redhat jar amq redhat org apach activemq artemi core persist impl journal jdbcjournalstoragemanag jdbcjournalstoragemanag java artemi server amq redhat jar amq redhat org apach activemq artemi core server impl activemqserverimpl createstoragemanag activemqserverimpl java artemi server amq redhat jar amq redhat org apach activemq artemi core server impl activemqserverimpl initialisepart activemqserverimpl java artemi server amq redhat jar amq redhat org apach activemq artemi core server impl liveonlyactiv run liveonlyactiv java artemi server amq redhat jar amq redhat org apach activemq artemi core server impl activemqserverimpl start activemqserverimpl java artemi server amq redhat jar amq redhat org apach activemq artemi jm server impl jmsservermanagerimpl start jmsservermanagerimpl java artemi jm server amq redhat jar amq redhat org apach activemq artemi integr filebrok start filebrok java artemi cli amq redhat jar amq redhat org apach activemq artemi cli command run execut run java artemi cli amq redhat jar amq redhat org apach activemq artemi cli artemi internalexecut artemi java artemi cli amq redhat jar amq redhat org apach activemq artemi cli artemi execut artemi java artemi cli amq redhat jar amq redhat sun reflect nativemethodaccessorimpl invok nativ method jar sun reflect nativemethodaccessorimpl invok nativemethodaccessorimpl java jar sun reflect delegatingmethodaccessorimpl invok delegatingmethodaccessorimpl java jar java lang reflect method invok method java jar org apach activemq artemi boot artemi execut artemi java artemi boot jar amq redhat org apach activemq artemi boot artemi main artemi java artemi boot jar amq redhat info org apach activemq artemi core server amq protocol modul artemi server.ad protocol support core info org apach activemq artemi core server amq protocol modul artemi amqp protocol.ad protocol support amqp info org apach activemq artemi core server amq protocol modul artemi hornetq protocol.ad protocol support hornetq info org apach activemq artemi core server amq protocol modul artemi mqtt protocol.ad protocol support mqtt info org apach activemq artemi core server amq protocol modul artemi openwir protocol.ad protocol support openwir info org apach activemq artemi core server amq protocol modul artemi stomp protocol.ad protocol support stomp error org apach activemq artemi core server amq failur initialis java sql sqlsyntaxerrorexcept ora invalid datatyp oracl jdbc driver tcttioer processerror tcttioer java ojdbc jar oracl jdbc driver tcttioer processerror tcttioer java ojdbc jar oracl jdbc driver tcoall processerror tcoall java ojdbc jar oracl jdbc driver tcttifun receiv tcttifun java ojdbc jar oracl jdbc driver tcttifun dorpc tcttifun java ojdbc jar oracl jdbc driver tcoall dooall tcoall java ojdbc jar oracl jdbc driver tcstatement dooall tcstatement java ojdbc jar oracl jdbc driver tcstatement dooall tcstatement java ojdbc jar oracl jdbc driver tcstatement executeforrow tcstatement java ojdbc jar oracl jdbc driver oraclestat doexecutewithtimeout oraclestat java ojdbc jar oracl jdbc driver oraclestat executeupdateintern oraclestat java ojdbc jar oracl jdbc driver oraclestat executeupd oraclestat java ojdbc jar oracl jdbc driver oraclestatementwrapp executeupd oraclestatementwrapp java ojdbc jar org apach activemq artemi jdbc store jdbcutil createtableifnotexist jdbcutil java artemi jdbc store amq redhat jar amq redhat org apach activemq artemi jdbc store journal jdbcjournalimpl start jdbcjournalimpl java artemi jdbc store amq redhat jar amq redhat org apach activemq artemi core persist impl journal abstractjournalstoragemanag start abstractjournalstoragemanag java artemi server amq redhat jar amq redhat org apach activemq artemi core server impl activemqserverimpl initialisepart activemqserverimpl java artemi server amq redhat jar amq redhat org apach activemq artemi core server impl liveonlyactiv run liveonlyactiv java artemi server amq redhat jar amq redhat org apach activemq artemi core server impl activemqserverimpl start activemqserverimpl java artemi server amq redhat jar amq redhat org apach activemq artemi jm server impl jmsservermanagerimpl start jmsservermanagerimpl java artemi jm server amq redhat jar amq redhat org apach activemq artemi integr filebrok start filebrok java artemi cli amq redhat jar amq redhat org apach activemq artemi cli command run execut run java artemi cli amq redhat jar amq redhat org apach activemq artemi cli artemi internalexecut artemi java artemi cli amq redhat jar amq redhat org apach activemq artemi cli artemi execut artemi java artemi cli amq redhat jar amq redhat sun reflect nativemethodaccessorimpl invok nativ method jar sun reflect nativemethodaccessorimpl invok nativemethodaccessorimpl java jar sun reflect delegatingmethodaccessorimpl invok delegatingmethodaccessorimpl java jar java lang reflect method invok method java jar org apach activemq artemi boot artemi execut artemi java artemi boot jar amq redhat org apach activemq artemi boot artemi main artemi java artemi boot jar amq redhat.","amq"
"xpaa amq set transportconnector","get error updat activemq xml run pod readi probe fail transport listen port pelas help setup connector.thank amit rana.","jbossorg_sbs_forum","get error updat activemq xml run pod readi probe fail transport listen port pelas help setup connector.thank amit rana.","amq"
"configur activemq storag","activemq filesystem store messag inflight.learn configur dedic disk activemq jboss.","rht_knowledgebase_article","","amq"
"understand thread alloc activemq","easiest wai tune activemq deploy increas scaleabl reduc number thread work.default activemq configur make us thread isol produc consum.prevent produc block consum misbehav.","rht_knowledgebase_article","","amq"
