sys_title,sys_description,source,sys_content_plaintext,target
"amqp transport connector period excess cpu usag instanc org apach activemq transport amqp amqpprotocolconvert consumercontext creat","period amqp transport connector broker us excess cpu instanc org apach activemq transport amqp amqpprotocolconvert consumercontext creat memori releas","rht_knowledgebase_solution","","amq"
"overrid data valu activemq xml","like know data token get set activemq xml.awai overrid valu extern activemq xml.exampl set master slave need configur kahadb directori valu point share na locat.default configur set.","rht_knowledgebase_solution","","amq"
"disabl role base access fuse","edit follow file properti comment karaf secur servic amp osgi command scope osgi command function remov jmx role need edit karaf script bin directori remov follow java option djavax manag builder initi org apach karaf manag boot karafmbeanserverbuild","rht_knowledgebase_solution","","amq"
"web consol fail java jboss","web consol throw follow error start java java support jboss warn org eclips jetti servlet servlethandl org apach jasper jasperexcept pwc unabl compil class jsp pwc error occur line jsp file web inf tag form foreachmapentri tag pwc gener servlet error type java util map entri resolv.indirectli referenc requir class file org apach jasper compil defaulterrorhandl javacerror defaulterrorhandl java org apach jasper compil errordispatch javacerror errordispatch java org apach jasper compil compil generateclass compil java org apach jasper compil compil compil compil java org apach jasper jspcompilationcontext compil jspcompilationcontext java org apach jasper servlet jspservletwrapp loadtagfil jspservletwrapp java org apach jasper compil tagfileprocessor loadtagfil tagfileprocessor java org apach jasper compil tagfileprocessor access tagfileprocessor java org apach jasper compil tagfileprocessor tagfileloadervisitor visit tagfileprocessor java org apach jasper compil node customtag accept node java org apach jasper compil node node visit node java org apach jasper compil node visitor visitbodi node java org apach jasper compil tagfileprocessor tagfileloadervisitor visit tagfileprocessor java org apach jasper compil node customtag accept node java org apach jasper compil node node visit node java org apach jasper compil node visitor visitbodi node java org apach jasper compil tagfileprocessor tagfileloadervisitor visit tagfileprocessor java org apach jasper compil node customtag accept node java org apach jasper compil node node visit node java org apach jasper compil node visitor visitbodi node java org apach jasper compil node visitor visit node java org apach jasper compil node root accept node java org apach jasper compil node node visit node java org apach jasper compil tagfileprocessor loadtagfil tagfileprocessor java org apach jasper compil compil generatejava compil java org apach jasper compil compil compil compil java org apach jasper jspcompilationcontext compil jspcompilationcontext java org apach jasper servlet jspservletwrapp servic jspservletwrapp java org apach jasper servlet jspservlet servicejspfil jspservlet java org apach jasper servlet jspservlet servic jspservlet java javax servlet http httpservlet servic httpservlet java org eclips jetti servlet jsppropertygroupservlet servic jsppropertygroupservlet java org eclips jetti servlet servlethold handl servlethold java org eclips jetti servlet servlethandl cachedchain dofilt servlethandl java org springframework web filter requestcontextfilt dofilterintern requestcontextfilt java org springframework web filter onceperrequestfilt dofilt onceperrequestfilt java org eclips jetti servlet servlethandl cachedchain dofilt servlethandl java org apach activemq web sessionfilt dofilt sessionfilt java org eclips jetti servlet servlethandl cachedchain dofilt servlethandl java org apach activemq web filter applicationcontextfilt dofilt applicationcontextfilt java org eclips jetti servlet servlethandl cachedchain dofilt servlethandl java org eclips jetti servlet servlethandl dohandl servlethandl java org eclips jetti server handler scopedhandl handl scopedhandl java org eclips jetti secur securityhandl handl securityhandl java org eclips jetti server session sessionhandl dohandl sessionhandl java org eclips jetti server handler contexthandl dohandl contexthandl java org eclips jetti servlet servlethandl doscop servlethandl java org eclips jetti server session sessionhandl doscop sessionhandl java org eclips jetti server handler contexthandl doscop contexthandl java org eclips jetti server handler scopedhandl handl scopedhandl java org eclips jetti server handler handlercollect handl handlercollect java org eclips jetti secur securityhandl handl securityhandl java org eclips jetti server handler handlercollect handl handlercollect java org eclips jetti server handler handlerwrapp handl handlerwrapp java org eclips jetti server server handl server java org eclips jetti server abstracthttpconnect handlerequest abstracthttpconnect java org eclips jetti server abstracthttpconnect headercomplet abstracthttpconnect java org eclips jetti server abstracthttpconnect requesthandl headercomplet abstracthttpconnect java org eclips jetti http httpparser parsenext httpparser java org eclips jetti http httpparser parseavail httpparser java org eclips jetti server asynchttpconnect handl asynchttpconnect java nio selectchannelendpoint handl selectchannelendpoint java nio selectchannelendpoint run selectchannelendpoint java org eclips jetti util thread queuedthreadpool runjob queuedthreadpool java org eclips jetti util thread queuedthreadpool run queuedthreadpool java java lang thread run thread java.","rht_knowledgebase_solution","","amq"
"hawtio consol destin folder queue topic","instal queue topic produc consum attach hawtio web base administr interfac queue properti.usual jm queue topic icon normal appear activemq tab user interfac gener quot folder quot icon appear.click icon jm destin properti.","rht_knowledgebase_solution","","amq"
"jboss fuse start window encount malformedurlexcept","clean instal window develop start fuse fuse bat configur jdk.error fuse log file error bin fileinstal org apach felix fileinstal fail instal artifact jboss fuse redhat auth java net malformedurlexcept invalid syntax instruct bundl symbolicnam jboss fuse.look http www aqut biz code bnd org opsj pax swissbox bnd bndutil parseinstruct bndutil java org opsj pax url wrap org opsj pax url wrap intern parser.parser java org opsj pax url wrap org opsj pax url wrap intern connect.connect java org opsj pax url wrap org opsj pax url wrap intern activ createconnect activ java org opsj pax url wrap org opsj pax url wrap intern activ createconnect activ java org opsj pax url wrap org opsj pax url common handler handleractiv handler openconnect handleractiv java org opsj pax url wrap org apach felix framework urlhandlersstreamhandlerproxi openconnect urlhandlersstreamhandlerproxi java org apach felix framework jar java net url openconnect url java java net url openstream url java org apach felix fileinstal intern directorywatch instal directorywatch java org apach felix fileinstal org apach felix fileinstal intern directorywatch instal directorywatch java org apach felix fileinstal org apach felix fileinstal intern directorywatch doprocess directorywatch java org apach felix fileinstal org apach felix fileinstal intern directorywatch process directorywatch java org apach felix fileinstal org apach felix fileinstal intern directorywatch run directorywatch java org apach felix fileinstal.","rht_knowledgebase_solution","","amq"
"known issu activemq daylight save time chang","oper.run dai light save chang come.known issu jboss fuse run switch period.activemq number queue ttl valu set messag.","rht_knowledgebase_solution","","amq"
"sql server log file shrink fail amq mainten","amq sql server messag store.attempt shrink databas log follow error encount.shrink log file sgamqxd log logic log file locat end file us.dbid fileid currents minimums usedpag estimatedpag stop amq servic shrink complet successfulli.uncommit transact caus log lock.","rht_knowledgebase_solution","","amq"
"red hat product affect cve","jboss eap impact cve.apach vulner cve.","rht_knowledgebase_solution","","amq"
"wai persist consum messg databas","tell stop remov persist messag consum.messag remov fro persist mechan oracl.","rht_knowledgebase_solution","","amq"
"tune activemq huge number consum destin","activemq tune support client connect destin","rht_knowledgebase_solution","","amq"
"messag download oper consol","need consol graphic oper consol product provid allow download upload messag especi byte messag displai byte byte messag configur enqueu persist messag featur need messag us bytesmessag.addit product support team typic need brows download investig repair messag case incid.","rht_knowledgebase_solution","","amq"
"featur restor data journal certain point time","need abl restor data kahadb vocabulari quot journal quot certain point time precis second.requir multipl system need restor consist state.","rht_knowledgebase_solution","","amq"
"ora privleg error jdbc persist","amq jboss eap.us jdbc persist configur amq.backend oracl.see follow exceptiom error eventhough tabl creat.everytim error.refer case case happen configur file.creat tabl activemq msg number null contain varchar msgid prod varchar msgid seq number expir number msg blob primari kei java sql sqlsyntaxerrorexcept ora insuffici privileg creat tabl activemq ack contain varchar null sub dest varchar client varchar null sub varchar null selector varchar ack number primari kei contain client sub java sql sqlsyntaxerrorexcept ora insuffici privileg let know privleg error.","rht_knowledgebase_solution","","amq"
"send text messag activemq curl command","send text messag activemq curl command need access activemq post messag viva curl","rht_knowledgebase_solution","","amq"
"set jm request timeout messag individu queue","wai us jmsconstant jm request timeout messag requir need specifi timeout messag produc endpoint camel rout.redhat camel version.research attach jmsconstant jm request timeout header set timeout messag individu.tri us header actual set timeout accordingli notic http camel apach org jm html http camel apach org jm html mention featur onward.caveat jmsconstant jm request timeout redhat.","rht_knowledgebase_solution","","amq"
"jboss amq listen stop process high load","jboss amq listen stop process high load load test env.simul load request hour.check hawtio enqueu listen dequeu stop work.manual dummi applic stage switchyard server insert data queue enqueu listen count increas listen abl data.signific jboss log amq log.","rht_knowledgebase_solution","","amq"
"activemq nativ bridg connect error","add nativ bridg connect tcp bridg connect start error log relat secur problem.config look wai jm brige connector amq broker log observ strang behavior creat amq connect secur problem password.warn amq transportconnect ivemq broker transportconnect org apach activemq activemq osgi redhat fail add connect osi prod reason java lang securityexcept user null password invalid.","rht_knowledgebase_solution","","amq"
"differ destin us differ usag mkahadb","plan us mkahadb automat destin persist adapt kahadb instanc destin.differ systemusag memoryusag storageusag tempusag differ destin us storeusagehighwatermark virtual topic mkahadb.","rht_knowledgebase_solution","","amq"
"activemq cluster node configur exampl","real life exampl activemq cluster configur.link http activemq apach org failov transport refer html show exampl.provid format host host host.","rht_knowledgebase_solution","","amq"
"user role need enabl monitor jboss","need inform minimum user role need enabl new user perform nagio monitor.new user super user need configur new user monitor jboss contain nagio follow purpos check health memori thread statu jmx bean check pend messag given queue.","rht_knowledgebase_solution","","amq"
"prioriti messag jdbc store prioriti messag slow retriev jdbc store","entmq http issu jboss org brows entmq fix broker appear slow prioriti messag jdbc persist store issu impact broker contain fix entmq http issu jboss org brows entmq configur us prioritymessag true broker destin polici us jdbc persist storag","rht_knowledgebase_solution","","amq"
"configur jboss fuse jmx connect allow local client","configur jboss fuse local jmx client connect.wai restrict remot jmx client connect jboss fuse.","rht_knowledgebase_solution","","amq"
"activemq resourc adapt us","accord http access redhat com articl http access redhat com articl quot jboss contain interoper quot support version resourc adapt redhat quot.paragraph state extra directori distribut.unpack jboss pre patch redhat zip file apach activemq redhat bin zip quot extra quot directori.unpack file look lib file file quot activemq rar txt quot sai activemq rar longer includ distribut.download separ http repo maven org maven org apach activemq activemq rar file quot activemq rar redhat rar quot option directori.rar us.quot option quot download maven cenral.affect upgrad base name rar bound releas redhat.need chang patch amq new new patch releas.instanc look patch jboss fuse redhat zip jboss fuse redhat zip apach activemq redhat lib option activemq rar redhat rar wich newer redhat.us rar patch broker patch.","rht_knowledgebase_solution","","amq"
"setup fusemq enterpris instanc us activemq jca resourc adapt jboss eap interact","setup fusemq enterpris instanc us activemq jca resourc adapt jboss eap interact","rht_knowledgebase_solution","","amq"
"download fusesourc product","fusesourc relat product download avail version jboss fuse quot fuse quot option quot product quot drop list dowload page quot free softwar quot option download fuse sourc file discov.intend behavior problem download link.","rht_knowledgebase_solution","","amq"
"won network bridg start","see follow messag activemq log warn start network bridg xxx async fals amp network true tcp java net connectexcept connect refus org apach activemq network discoverynetworkconnector simpl discoveri agent","rht_knowledgebase_solution","","amq"
"red hat account download fusesourc softwar","valid red hat user abl download fusesourc product previous longer abl","rht_knowledgebase_solution","","amq"
"random option work network connector","try understand random network connector need us","rht_knowledgebase_solution","","amq"
"load balanc specif destin network broker","current setup singl broker consum given destin allow load balanc redund case consum slow fail.move network broker want maintain network mean destin consum shouldn depend broker broker hang slow affect consum.wai configur.","rht_knowledgebase_solution","","amq"
"consequ corrupt kahadb index","understand kahadb corrupt issu usual startup shutdown.consequ run corrupt activ instanc.","rht_knowledgebase_solution","","amq"
"support activemq jboss eap","jboss eap support activemq run subscript requir instead hornetq jboss eap standalon activemq instanc support","rht_knowledgebase_solution","","amq"
"us date time stamp fuse enterpris product log file name","default log configur gener file name append like replac time date logj properti file","rht_knowledgebase_solution","","amq"
"configur network adapt automat reconnect event error","encount error network connector shut inact fusemq log info worker demandforwardingbridgesupport demandforwardingbridgesupport org apach activemq activemq core fuse network connect mybrok tcp shutdown local error org apach activemq transport inactivityioexcept channel inact long tcp error encount network connector stop","rht_knowledgebase_solution","","amq"
"user role need enabl monitor jboss","need inform minimum user role need enabl new user perform nagio monitor.new user super user need configur new user monitor jboss contain nagio follow purpos check health memori thread statu jmx bean check pend messag given queue.","rht_knowledgebase_solution","","amq"
"configur jboss fuse jmx connect allow local client","configur jboss fuse local jmx client connect.wai restrict remot jmx client connect jboss fuse.","rht_knowledgebase_solution","","amq"
"miss artifact public maven repositori fuse amq patch","custom bundl user depend jaa modul version redhat depend issu upgrad redhat requir jboss fuse redhat zip org apach karaf jaa org apach karaf jaa modul redhat provid user maven miss artifact issu maven artifact maven repositori redhat repositori list defin org opsj pax url mvn cfg publish","rht_knowledgebase_solution","","amq"
"activemq resourc adapt us","accord http access redhat com articl http access redhat com articl quot jboss contain interoper quot support version resourc adapt redhat quot.paragraph state extra directori distribut.unpack jboss pre patch redhat zip file apach activemq redhat bin zip quot extra quot directori.unpack file look lib file file quot activemq rar txt quot sai activemq rar longer includ distribut.download separ http repo maven org maven org apach activemq activemq rar file quot activemq rar redhat rar quot option directori.rar us.quot option quot download maven cenral.affect upgrad base name rar bound releas redhat.need chang patch amq new new patch releas.instanc look patch jboss fuse redhat zip jboss fuse redhat zip apach activemq redhat lib option activemq rar redhat rar wich newer redhat.us rar patch broker patch.","rht_knowledgebase_solution","","amq"
"jboss transact failov transport intermitt duplic messag failov transport reconnect transact","intermitt failov transport reconnect transact duplic messag deliv consum amq allow forc open transact rollback failov","rht_knowledgebase_solution","","amq"
"set prefetch global messagebrok consum","set prefetch global messagebrok consum basi notic applic pick messag activ queue signific delai","rht_knowledgebase_solution","","amq"
"chang prefetch size jm consum","chang prefetch size jm consum.prefetch size set default.configur number messag consum prefetch.","rht_knowledgebase_solution","","amq"
"enabl activemq web consol","enabl activemq web consol step configur activemq web consol monitor embed broker fuse esb enabl fuse broker web consol","rht_knowledgebase_solution","","amq"
"activemq produc receiv except broker run memori","activemq produc receiv except broker run memori.fuse messag broker produc receiv except broker run memori.","rht_knowledgebase_solution","","amq"
"virtual destin activemq work","fuse messag broker virtual destin work purpos activemq virtual destin virtual destin help scenario durabl subscript amp network broker","rht_knowledgebase_solution","","amq"
"java lang illegalstateexcept log transact com ibm jmqi jmqixaresourc namedxaresourc","see follow error servicemix log file try commit transact java lang illegalstateexcept log transact com ibm jmqi jmqixaresourc namedxaresourc.org apach geronimo transact manag transactionimpl transactionbranch getresourcenam transactionimpl java org apach geronimo transact log howllog prepar howllog java org apach geronimo transact manag transactionimpl internalprepar transactionimpl java org apach geronimo transact manag transactionimpl commit transactionimpl java org apach geronimo transact manag transactionmanagerimpl commit transactionmanagerimpl java org springframework transact jta jtatransactionmanag docommit jtatransactionmanag java org springframework transact support abstractplatformtransactionmanag processcommit abstractplatformtransactionmanag java org springframework transact support abstractplatformtransactionmanag commit abstractplatformtransactionmanag java org apach ari transact geronimoplatformtransactionmanag commit geronimoplatformtransactionmanag java sun reflect nativemethodaccessorimpl invok nativ method sun reflect nativemethodaccessorimpl invok nativemethodaccessorimpl java sun reflect delegatingmethodaccessorimpl invok delegatingmethodaccessorimpl java java lang reflect method invok method java org apach ari proxi impl proxyhandl invok proxyhandl java org apach ari proxi org apach ari proxi impl defaultwrapp invok defaultwrapp java org apach ari proxi org apach ari proxi impl proxyhandl invok proxyhandl java org apach ari proxi proxi commit unknown sourc org springframework transact releas org springframework jm listen abstractpollingmessagelistenercontain receiveandexecut abstractpollingmessagelistenercontain java org springframework jm releas org springframework jm listen defaultmessagelistenercontain asyncmessagelistenerinvok invokelisten defaultmessagelistenercontain java org springframework jm releas org springframework jm listen defaultmessagelistenercontain asyncmessagelistenerinvok executeongoingloop defaultmessagelistenercontain java org springframework jm releas org springframework jm listen defaultmessagelistenercontain asyncmessagelistenerinvok run defaultmessagelistenercontain java org springframework jm releas java util concurr threadpoolexecutor worker runtask threadpoolexecutor java java util concurr threadpoolexecutor worker run threadpoolexecutor java java lang thread run thread java.","rht_knowledgebase_solution","","amq"
"camel rout roll local jm transact augment messag except detail forward messag queue","default camel rout mark quot transact quot us transactionerrorhandl.except occur transactionerrorhandl caus transact roll.messag avail origin queue consum rout.default activemq redeliv messag time consum case camel rout messag dead letter queue.consequ transact messag sent activemq context transact roll.quot activemq queue quot transact quot propag requir quot quot activemq queue quot process myprocessor throw except test purpos quot activemq queue quot exampl transact roll messag sent quot queue quot roll.rollback transact captur except origin messag forward queue.","rht_knowledgebase_solution","","amq"
"enabl log fuse esb","enabl log fuse esb","rht_knowledgebase_solution","","amq"
"us certif verisign thawt commerci certif author","us certif verisign thawt commerci certif author.configur jvm us certif.keytool import certif broker keystor suffici need instal client trust store.","rht_knowledgebase_solution","","amq"
"download fusesourc product","fusesourc relat product download avail version jboss fuse quot fuse quot option quot product quot drop list dowload page quot free softwar quot option download fuse sourc file discov.intend behavior problem download link.","rht_knowledgebase_solution","","amq"
"us date time stamp fuse enterpris product log file name","default log configur gener file name append like replac time date logj properti file","rht_knowledgebase_solution","","amq"
"configur network adapt automat reconnect event error","encount error network connector shut inact fusemq log info worker demandforwardingbridgesupport demandforwardingbridgesupport org apach activemq activemq core fuse network connect mybrok tcp shutdown local error org apach activemq transport inactivityioexcept channel inact long tcp error encount network connector stop","rht_knowledgebase_solution","","amq"
"support activemq jboss eap","jboss eap support activemq run subscript requir instead hornetq jboss eap standalon activemq instanc support","rht_knowledgebase_solution","","amq"
"java eofexcept transport connect fuse messag broker log","follow error mean warn transport connect tcp fail java eofexcept org apach activemq broker transportconnect transport activemq transport tcp","rht_knowledgebase_solution","","amq"
"kahadb log file remov","kahadb messag store notic build kahadb log file remov.caus broker reach store limit trigger produc flow control enabl case deplet disk space.","rht_knowledgebase_solution","","amq"
"fuse esb karaf shell script stop command failur","fuse esb karaf shell allow autom script run shell sourc.command script separ script run shell sourc.command script fail script execut termin point expect behav like normal unix shell script continu.","rht_knowledgebase_solution","","amq"
"configur fuse messag broker jboss memori limit","configur broker memori limit memori limit affect produc flow control number rout depend activemq endpoint.find queue messag consum end larg number inflight exchang stop.soon purg queue recov.read activemq look log thought reason produc flow control.modifi default activemq xml configur directori fuse quot producerflowcontrol quot fals quot quot producerflowcontrol quot fals quot belief stop occur known issu delai cleanup memori leak camel jm compon activemq failov transport appear situat activemqbytesmessag instanc hang client heap longer expect.appear messag hang hour jm produc complet happen messag messag eventu clean messag vari size outofmemoryerror continu climb memori percent.diagnos.","rht_knowledgebase_solution","","amq"
