sys_title,sys_description,source,sys_content_plaintext,target
"consol web consol activemq web consol","tri instal jboss instal quot activemq web consol quot follow quot activemq web consol quot instal follow jbossa karaf root featur instal activemq web consol reboot jboss consol throw follow warn qtp servlethandl lips jetti util log javautillog org eclips jetti util activemqweb index jsp javax elexcept java lang securityexcept authent fail javax beanelresolv getvalu beanelresolv java javax compositeelresolv getvalu compositeelresolv java com sun parser astvalu getvalu astvalu java com sun valueexpressionimpl getvalu valueexpressionimpl java org apach jasper runtim pagecontextimpl evaluateexpress pagecontextimpl java org apach jsp index jsp jspservic org apach jsp index jsp org apach jasper runtim httpjspbase servic httpjspbase java javax servlet http httpservlet servic httpservlet java org apach jasper servlet jspservletwrapp servic jspservletwrapp java org apach jasper servlet jspservlet servicejspfil jspservlet java org apach jasper servlet jspservlet servic jspservlet java javax servlet http httpservlet servic httpservlet java org opsj pax web jsp jspservletwrapp jspservletwrapp java org opsj pax web jsp jspservletwrapp jspservletwrapp java org opsj pax swissbox core contextclassloaderutil dowithclassload contextclassloaderutil java org opsj pax web jsp jspservletwrapp servic jspservletwrapp java org eclips jetti servlet servlethold handl servlethold java org eclips jetti servlet servlethandl cachedchain dofilt servlethandl java org springframework web filter requestcontextfilt dofilterintern requestcontextfilt java org springframework web filter onceperrequestfilt dofilt onceperrequestfilt java org eclips jetti servlet servlethandl cachedchain dofilt servlethandl java org apach activemq web sessionfilt dofilt sessionfilt java org eclips jetti servlet servlethandl cachedchain dofilt servlethandl java org apach activemq web filter applicationcontextfilt dofilt applicationcontextfilt java org eclips jetti servlet servlethandl cachedchain dofilt servlethandl java com opensymphoni sitemesh webapp sitemeshfilt obtaincont sitemeshfilt java com opensymphoni sitemesh webapp sitemeshfilt dofilt sitemeshfilt java org eclips jetti servlet servlethandl cachedchain dofilt servlethandl java org opsj pax web servic intern welcomefilesfilt dofilt welcomefilesfilt java org eclips jetti servlet servlethandl cachedchain dofilt servlethandl java org eclips jetti servlet servlethandl dohandl servlethandl java org opsj pax web servic jetti intern httpserviceservlethandl dohandl httpserviceservlethandl java org eclips jetti server handler scopedhandl handl scopedhandl java org eclips jetti secur securityhandl handl securityhandl java org eclips jetti server session sessionhandl dohandl sessionhandl java org eclips jetti server handler contexthandl dohandl contexthandl java org opsj pax web servic jetti intern httpservicecontext dohandl httpservicecontext java org eclips jetti servlet servlethandl doscop servlethandl java org eclips jetti server session sessionhandl doscop sessionhandl java org eclips jetti server handler contexthandl doscop contexthandl java org eclips jetti server handler scopedhandl handl scopedhandl java org opsj pax web servic jetti intern jettyserverhandlercollect handl jettyserverhandlercollect java org eclips jetti server handler handlerwrapp handl handlerwrapp java org eclips jetti server server handl server java org eclips jetti server abstracthttpconnect handlerequest abstracthttpconnect java org eclips jetti server abstracthttpconnect headercomplet abstracthttpconnect java org eclips jetti server abstracthttpconnect requesthandl headercomplet abstracthttpconnect java org eclips jetti http httpparser parsenext httpparser java org eclips jetti http httpparser parseavail httpparser java org eclips jetti server asynchttpconnect handl asynchttpconnect java org eclips jetti nio selectchannelendpoint handl selectchannelendpoint java org eclips jetti nio selectchannelendpoint run selectchannelendpoint java org eclips jetti util thread queuedthreadpool runjob queuedthreadpool java org eclips jetti util thread queuedthreadpool run queuedthreadpool java java lang thread run thread java caus java lang securityexcept authent fail org apach karaf manag jaasauthent authent jaasauthent java javax manag remot rmi rmiserverimpl donewcli rmiserverimpl java javax manag remot rmi rmiserverimpl newclient rmiserverimpl java sun reflect nativemethodaccessorimpl invok nativ method sun reflect nativemethodaccessorimpl invok nativemethodaccessorimpl java sun reflect delegatingmethodaccessorimpl invok delegatingmethodaccessorimpl java java lang reflect method invok method java sun rmi server unicastserverref dispatch unicastserverref java sun rmi transport transport run transport java sun rmi transport transport run transport java java secur accesscontrol doprivileg nativ method sun rmi transport transport servicecal transport java sun rmi transport tcp tcptransport handlemessag tcptransport java sun rmi transport tcp tcptransport connectionhandl run tcptransport java sun rmi transport tcp tcptransport connectionhandl run tcptransport java java util concurr threadpoolexecutor runwork threadpoolexecutor java java util concurr threadpoolexecutor worker run threadpoolexecutor java java lang thread run thread java sun rmi transport streamremotecal exceptionreceivedfromserv streamremotecal java sun rmi transport streamremotecal executecal streamremotecal java sun rmi server unicastref invok unicastref java javax manag remot rmi rmiserverimpl stub newclient unknown sourc javax manag remot rmi rmiconnector getconnect rmiconnector java javax manag remot rmi rmiconnector connect rmiconnector java javax manag remot jmxconnectorfactori connect jmxconnectorfactori java org apach activemq web remotejmxbrokerfacad createconnect remotejmxbrokerfacad java org apach activemq web remotejmxbrokerfacad getmbeanserverconnect remotejmxbrokerfacad java org apach activemq web remotejmxbrokerfacad getbrokeradmin remotejmxbrokerfacad java org apach activemq web remotejmxbrokerfacad getbrokernam remotejmxbrokerfacad java sun reflect nativemethodaccessorimpl invok nativ method sun reflect nativemethodaccessorimpl invok nativemethodaccessorimpl java sun reflect delegatingmethodaccessorimpl invok delegatingmethodaccessorimpl java java lang reflect method invok method java javax beanelresolv getvalu beanelresolv java.caus javax secur auth login failedloginexcept login fail org apach karaf jaa modul properti propertiesloginmodul login propertiesloginmodul java org apach karaf jaa boot proxyloginmodul login proxyloginmodul java sun reflect nativemethodaccessorimpl invok nativ method follow articl visit check quot properti quot quot user properti quot file uncom user.enabl activemq web consol http access redhat com site solut.","rht_knowledgebase_solution","","amq"
"activemq broker health jmx statu chang automat","activemq broker health jmx mbean monitor broker statu jmx bean org apach activemq type broker brokernam localhost servic health currentstatu jmx attribut updat automat chang broker health run low disk space.mbean jmx oper health healthlist currentstatu jmx attribut get updat correctli jmx jpg http access redhat com site site default file imag jmx jpg.","rht_knowledgebase_solution","","amq"
"creat offlin maven repositori jboss fuse","wai creat offlin repositori jboss final releas obtain maven repositori jboss fuse wai maven repositori depend jboss eap fsw like maven repositori jboss fuse maven repositori fuse subscript servic","rht_knowledgebase_solution","","amq"
"connect failur topic subscrib ack messag deliv subscrib applic","scenario topic subscrib connect topic singl publish.race condit subscrib lose connect broker.broker log client ack miss messag messag deliv client applic layer.background scenario broker kill topic subscrib connect possibl inact debug kill previou stale connect tcp org apach activemq broker transportconnect activemq transport tcp topic subscrib reconnect failov transport reestablish session expect info ad session sessioninfo commandid responserequir fals sessionid abcab org apach activemq broker util loggingbrokerplugin activemq transport tcp info ad consum consumerinfo commandid responserequir true consumerid abcab destin topic test prefetchs maximumpendingmessagelimit browser fals dispatchasync true selector null subscriptionnam null noloc fals exclus fals retroact fals prioriti brokerpath null optimizedacknowledg fals norangeack fals additionalpred null org apach activemq broker util loggingbrokerplugin activemq transport tcp debug uat amq ad consum abcab destin topic test org apach activemq broker region abstractregion activemq transport tcp acknowledg observ broker log miss messag.info acknowledg messag client abcab uatwm org apach activemq broker util loggingbrokerplugin activemq transport tcp client subscrib receiv messag.","rht_knowledgebase_solution","","amq"
"access hawtio caus transfer nexu maven repositori index properti fail beta","access quot http localhost hawtio quot consol follow error observ log.info startup timer mavenindexerfacad maven index mavenindexerfacad hawt hawtio maven index redhat store maven index file local directori jboss redhat data mavenindex error startup timer mavenindexerfacad maven index mavenindexerfacad hawt hawtio maven index redhat fail updat maven repositori indic java ioexcept transfer nexu maven repositori index properti fail error transfer file connect time connect java ioexcept transfer nexu maven repositori index properti fail error transfer file connect time connect org apach maven index updat wagonhelp wagonfetch retriev wagonhelp java hawt hawtio maven index redhat org apach maven index updat wagonhelp wagonfetch retriev wagonhelp java hawt hawtio maven index redhat org apach maven index updat defaultindexupdat downloadindexproperti defaultindexupdat java hawt hawtio maven index redhat org apach maven index updat defaultindexupdat access defaultindexupdat java hawt hawtio maven index redhat org apach maven index updat defaultindexupdat indexadaptor setproperti defaultindexupdat java hawt hawtio maven index redhat org apach maven index updat defaultindexupdat fetchandupdateindex defaultindexupdat java hawt hawtio maven index redhat org apach maven index updat defaultindexupdat fetchandupdateindex defaultindexupdat java hawt hawtio maven index redhat hawt maven index mavenindexerfacad downloadorupdateindic mavenindexerfacad java hawt hawtio maven index redhat hawt maven index mavenindexerfacad init mavenindexerfacad java hawt hawtio maven index redhat hawt maven index asyncmavenindexerfacadefactori createmavenindex asyncmavenindexerfacadefactori java hawt hawtio maven index redhat hawt maven index asyncmavenindexerfacadefactori run asyncmavenindexerfacadefactori java hawt hawtio maven index redhat java util timerthread mainloop unknown sourc java util timerthread run unknown sourc caus org apach maven wagon transferfailedexcept error transfer file connect time connect org apach maven wagon provid http lightweighthttpwagon fillinputdata lightweighthttpwagon java hawt hawtio maven index redhat org apach maven wagon streamwagon getinputstream streamwagon java hawt hawtio maven index redhat org apach maven wagon streamwagon getifnew streamwagon java hawt hawtio maven index redhat org apach maven wagon streamwagon streamwagon java hawt hawtio maven index redhat org apach maven index updat wagonhelp wagonfetch retriev wagonhelp java hawt hawtio maven index redhat.caus java net connectexcept connect time connect java net plainsocketimpl socketconnect nativ method java net plainsocketimpl doconnect unknown sourc java net plainsocketimpl connecttoaddress unknown sourc java net plainsocketimpl connect unknown sourc java net sockssocketimpl connect unknown sourc java net socket connect unknown sourc java net socket connect unknown sourc sun net networkcli doconnect unknown sourc sun net www http httpclient openserv unknown sourc sun net www http httpclient openserv unknown sourc sun net www http httpclient.unknown sourc sun net www http httpclient new unknown sourc sun net www http httpclient new unknown sourc sun net www protocol http httpurlconnect getnewhttpcli unknown sourc sun net www protocol http httpurlconnect plainconnect unknown sourc sun net www protocol http httpurlconnect connect unknown sourc sun net www protocol http httpurlconnect getinputstream unknown sourc java net httpurlconnect getresponsecod unknown sourc org apach maven wagon provid http lightweighthttpwagon fillinputdata lightweighthttpwagon java hawt hawtio maven index redhat.","rht_knowledgebase_solution","","amq"
"error start bundl blueprint file","user get error similar warn edhat deploi fileinstal.org apach felix fileinstal redhat error start bundl blueprint file jboss redhat deploi tradeenrichmentadapterrout xml org osgi framework bundleexcept unresolv constraint bundl tradeenrichmentadapterrout xml unabl resolv miss requir osgi wire packag osgi wire packag org apach camel impl org apach felix framework felix resolvebundlerevis felix java org apach felix framework redhat jar org apach felix framework felix startbundl felix java org apach felix framework redhat jar org apach felix framework bundleimpl start bundleimpl java org apach felix framework redhat jar org apach felix fileinstal intern directorywatch startbundl directorywatch java org apach felix fileinstal redhat org apach felix fileinstal intern directorywatch startbundl directorywatch java org apach felix fileinstal redhat org apach felix fileinstal intern directorywatch startallbundl directorywatch java org apach felix fileinstal redhat org apach felix fileinstal intern directorywatch process directorywatch java org apach felix fileinstal redhat org apach felix fileinstal intern directorywatch run directorywatch java org apach felix fileinstal redhat.","rht_knowledgebase_solution","","amq"
"jboss fuse jboss affect openssl heartble bug","jboss fuse jboss affect openssl heartble bug.openssl jboss fuse jboss version.","rht_knowledgebase_solution","","amq"
"escap password special charact fuse","ldap password contain special charact unabl encod password properli blueprint configur initialcontextfactori com sun jndi ldap ldapctxfactori connect usernam ldapus connect password pwd amp receiv error bundl start","rht_knowledgebase_solution","","amq"
"fuse manag consol differ jon","role fuse manag consol.jon fit solut advantag jon server compar fmc perspect fuse contain.","rht_knowledgebase_solution","","amq"
"configur ldap permiss","red hat document configur destin permiss ldap sampl open ldap.set.","rht_knowledgebase_solution","","amq"
"get user test author write queue activemq dlq disconnect consum broker","try disconnect consum secur broker rais follow secur except.applic send messag expiri timeout broker configur authent author.client user test need write permiss destin activemq dlq send messag destin.warn regionbrok ivemq broker region regionbrok org apach activemq activemq osgi redhat caught except send dlq messag drop fals ack fals lock true java lang securityexcept user test author write queue activemq dlq org apach activemq secur authorizationbrok send authorizationbrok java org apach activemq activemq osgi redhat org apach activemq broker mutablebrokerfilt send mutablebrokerfilt java org apach activemq activemq osgi redhat org apach activemq util brokersupport doresend brokersupport java org apach activemq activemq osgi redhat org apach activemq util brokersupport resendnocopi brokersupport java org apach activemq activemq osgi redhat org apach activemq broker region regionbrok sendtodeadletterqueu regionbrok java org apach activemq activemq osgi redhat org apach activemq broker brokerfilt sendtodeadletterqueu brokerfilt java org apach activemq activemq osgi redhat org apach activemq broker brokerfilt sendtodeadletterqueu brokerfilt java org apach activemq activemq osgi redhat org apach activemq advisori advisorybrok sendtodeadletterqueu advisorybrok java org apach activemq activemq osgi redhat org apach activemq broker brokerfilt sendtodeadletterqueu brokerfilt java org apach activemq activemq osgi redhat org apach activemq broker brokerfilt sendtodeadletterqueu brokerfilt java org apach activemq activemq osgi redhat org apach activemq broker mutablebrokerfilt sendtodeadletterqueu mutablebrokerfilt java org apach activemq activemq osgi redhat org apach activemq broker util redeliveryplugin sendtodeadletterqueu redeliveryplugin java org apach activemq activemq osgi redhat org apach activemq broker brokerfilt sendtodeadletterqueu brokerfilt java org apach activemq activemq osgi redhat org apach activemq broker brokerfilt sendtodeadletterqueu brokerfilt java org apach activemq activemq osgi redhat org apach activemq broker mutablebrokerfilt sendtodeadletterqueu mutablebrokerfilt java org apach activemq activemq osgi redhat org apach activemq broker region regionbrok messageexpir regionbrok java org apach activemq activemq osgi redhat org apach activemq broker brokerfilt messageexpir brokerfilt java org apach activemq activemq osgi redhat org apach activemq broker brokerfilt messageexpir brokerfilt java org apach activemq activemq osgi redhat org apach activemq advisori advisorybrok messageexpir advisorybrok java org apach activemq activemq osgi redhat org apach activemq broker brokerfilt messageexpir brokerfilt java org apach activemq activemq osgi redhat org apach activemq broker brokerfilt messageexpir brokerfilt java org apach activemq activemq osgi redhat org apach activemq broker mutablebrokerfilt messageexpir mutablebrokerfilt java org apach activemq activemq osgi redhat org apach activemq broker brokerfilt messageexpir brokerfilt java org apach activemq activemq osgi redhat org apach activemq broker brokerfilt messageexpir brokerfilt java org apach activemq activemq osgi redhat org apach activemq broker mutablebrokerfilt messageexpir mutablebrokerfilt java org apach activemq activemq osgi redhat org apach activemq broker region queue messageexpir queue java org apach activemq activemq osgi redhat org apach activemq broker region prefetchsubscript dispatchpend prefetchsubscript java org apach activemq activemq osgi redhat org apach activemq broker region prefetchsubscript add prefetchsubscript java org apach activemq activemq osgi redhat org apach activemq broker region queue doactualdispatch queue java org apach activemq activemq osgi redhat org apach activemq broker region queue dodispatch queue java org apach activemq activemq osgi redhat org apach activemq broker region queue removesubscript queue java org apach activemq activemq osgi redhat org apach activemq broker region abstractregion removeconsum abstractregion java org apach activemq activemq osgi redhat org apach activemq broker region regionbrok removeconsum regionbrok java org apach activemq activemq osgi redhat org apach activemq broker jmx managedregionbrok removeconsum managedregionbrok java org apach activemq activemq osgi redhat org apach activemq broker brokerfilt removeconsum brokerfilt java org apach activemq activemq osgi redhat org apach activemq broker brokerfilt removeconsum brokerfilt java org apach activemq activemq osgi redhat org apach activemq advisori advisorybrok removeconsum advisorybrok java org apach activemq activemq osgi redhat org apach activemq broker brokerfilt removeconsum brokerfilt java org apach activemq activemq osgi redhat org apach activemq broker brokerfilt removeconsum brokerfilt java org apach activemq activemq osgi redhat org apach activemq broker mutablebrokerfilt removeconsum mutablebrokerfilt java org apach activemq activemq osgi redhat org apach activemq broker brokerfilt removeconsum brokerfilt java org apach activemq activemq osgi redhat org apach activemq broker brokerfilt removeconsum brokerfilt java org apach activemq activemq osgi redhat org apach activemq broker mutablebrokerfilt removeconsum mutablebrokerfilt java org apach activemq activemq osgi redhat org apach activemq broker transportconnect processremoveconsum transportconnect java org apach activemq activemq osgi redhat org apach activemq command removeinfo visit removeinfo java org apach activemq activemq osgi redhat org apach activemq broker transportconnect servic transportconnect java org apach activemq activemq osgi redhat org apach activemq broker transportconnect oncommand transportconnect java org apach activemq activemq osgi redhat org apach activemq transport mutextransport oncommand mutextransport java org apach activemq activemq osgi redhat org apach activemq transport wireformatnegoti oncommand wireformatnegoti java org apach activemq activemq osgi redhat org apach activemq transport abstractinactivitymonitor oncommand abstractinactivitymonitor java org apach activemq activemq osgi redhat org apach activemq transport transportsupport doconsum transportsupport java org apach activemq activemq osgi redhat org apach activemq transport tcp tcptransport dorun tcptransport java org apach activemq activemq osgi redhat org apach activemq transport tcp tcptransport run tcptransport java org apach activemq activemq osgi redhat java lang thread run unknown sourc.","rht_knowledgebase_solution","","amq"
"connect jboss jconsol","like monitor jboss jmx jconsol","rht_knowledgebase_solution","","amq"
"jetti selectchannelconnector follow overriden valu","overrid jetti default port host follow properti jetti selectchannelconnector us valu.org opsj pax web cfg org osgi servic http port bind port org opsj pax web listen address bind address properti bind address bind port jetti xml.log info runtim worker abstractconnector org eclips jetti util start selectchannelconnector info runtim worker jettyserverimpl org opsj pax web pax web jetti pax web avail info runtim worker abstractconnector org eclips jetti util start niosocketconnectorwrapp.","rht_knowledgebase_solution","","amq"
"java ioexcept pipe close auto deploi bundl","got ioexcept step.unzip jboss instal archiv jboss redhat zip.postgresql jdbc jar installdir deploi directori.execut installdir bin start.execut installdir bin stop.execut installdir bin start.warn thread bndutil psj pax swissbox bnd bndutil org opsj pax url wrap bundl gener java ioexcept pipe close java pipedinputstream checkstateforrec pipedinputstream java java pipedinputstream receiv pipedinputstream java java pipedoutputstream write pipedoutputstream java java util zip zipoutputstream writeint zipoutputstream java java util zip zipoutputstream writeext zipoutputstream java java util zip zipoutputstream closeentri zipoutputstream java aqut lib osgi jar writeresourc jar java org opsj pax url wrap aqut lib osgi jar write jar java org opsj pax url wrap org opsj pax swissbox bnd bndutil run bndutil java org opsj pax url wrap got java ioexcept pipe close instal new featur.","rht_knowledgebase_solution","","amq"
"dlq creation consum pick","test dlq creation scenario amq.test case fail result dlq creation.transact session test.scenario.messag testq.consum read messag.consum di exit reach commit rollback.messag dlq.","rht_knowledgebase_solution","","amq"
"loginservic org eclips jetti secur authent basicauthent error amq log","quot activemqweb quot consol access look log notic follow messag appear repeatedli log.warn executor abstractlifecycl lips jetti util log javautillog org eclips jetti util fail org eclips jetti secur constraintsecurityhandl eeeea java lang illegalstateexcept loginservic org eclips jetti secur authent basicauthent baf org eclips jetti secur constraintsecurityhandl eeeea java lang illegalstateexcept loginservic org eclips jetti secur authent basicauthent baf org eclips jetti secur constraintsecurityhandl eeeea org eclips jetti secur authent loginauthent setconfigur loginauthent java org eclips jetti secur org eclips jetti secur securityhandl dostart securityhandl java org eclips jetti secur org eclips jetti secur constraintsecurityhandl dostart constraintsecurityhandl java org eclips jetti secur messag appear repeatedli log.","rht_knowledgebase_solution","","amq"
"fuse activemq master slave persist messag store share gf perform issu write disk","run master slave mode persist messag store share gf write disk take longer usual","rht_knowledgebase_solution","","amq"
"karaf client script return non zero statu except","execut karaf client script jboss fuse non zero return code return except occur error occur nice non zero return code","rht_knowledgebase_solution","","amq"
"user author creat topic queue error","send consum messag broker user attempt connect queue topic exist receiv error similar warn transport broker transportconnect org apach activemq activemq osgi redhat transport connect tcp fail java eofexcept info broker task transportconnect broker transportconnect org apach activemq activemq osgi redhat stop tcp fail securityexcept user usernam author creat topic activemq advisori connect","rht_knowledgebase_solution","","amq"
"plain connect factori pool transact camel activemq endpoint creat connect","configur connect creat torn broker second messag process.suspect transact manag open close connect begin commit transact.camel rout camel jm config broker.","rht_knowledgebase_solution","","amq"
"camel activemq compon send messag caus tcp connect reestablish","camel rout like tcp connect creat torn broker","rht_knowledgebase_solution","","amq"
